{
  "$schema": "./schema/dependencies.schema.json",
  "name": "ibmi-dependencies-example",
  "version": "1.0.0",
  "description": "Système de gestion de dépendances pour IBM i",
  "author": "IBMiservices",
  "license": "GPL-3.0",
  "repository": {
    "type": "git",
    "url": "https://github.com/IBMiservices/ibmi-dependencies.git"
  },
  "dependencies": {
    "example-library": {
      "repository": "https://github.com/exemple/exemple-library.git",
      "version": "^1.0.0",
      "ref": "v1.0.0"
    }
  },
  "devDependencies": {},
  "config": {
    "targetDir": "dep",
    "cleanGit": true,
    "cleanDocs": true,
    "updateBuildFiles": true,
    "recursiveDependencies": true
  }
}
 